Gaikotsu Gakudan to Lilia,骸骨楽団とリリア,がいこつがくだんとりりあ
Gaikotsu Gakudan to Lilia,骸骨楽団とリリア,がいこつがくだんとりりあ
Gaikotsu Gakudan to Lilia,骸骨楽団とリリア,がいこつがくだんとりりあ
Gaikotsu Gakudan to Lilia,骸骨楽団とリリア,がいこつがくだんとりりあ
Gaikotsu Gakudan to Lilia,骸骨楽団とリリア,がいこつがくだんとりりあ
Gaikotsu Gakudan to Lilia,骸骨楽団とリリア,がいこつがくだんとりりあ
Gaikotsu Gakudan to Lilia,骸骨楽団とリリア,がいこつがくだんとりりあ
Gaikotsu Gakudan to Lilia,骸骨楽団とリリア,がいこつがくだんとりりあ
Gainen no Plasma,概念のプラズマ,がいねんのぷらずま
Gaisen Parade,凱旋パレード,がいせんぱれーど
Gakeppuchi Oh My Girl,崖っぷちオーマイガール,がけっぷちおーまいがーる
Gakko Daikirai,学校だいきらーい,がっこうだいきらーい
Gakkou o Yasunda Hi no Koto,学校を休んだ日のこと,がっこうをやすんだひのこと
Gakkou o Yasunda Hi no Koto,学校を休んだ日のこと,がっこうをやすんだひのこと
Gakkou o Yasunda Hi no Koto,学校を休んだ日のこと,がっこうをやすんだひのこと
Gakkou o Yasunda Hi no Koto,学校を休んだ日のこと,がっこうをやすんだひのこと
Gakkou o Yasunda Hi no Koto,学校を休んだ日のこと,がっこうをやすんだひのこと
Gakkou o Yasunda Hi no Koto,学校を休んだ日のこと,がっこうをやすんだひのこと
Gakkyoku Battle! Kizuna Ikiri to Kashita Kouhai,楽曲バトル!紲星イキリと化した後輩,がっきょくばとるきずなぼしいきりとかしたこうはい
Gakudan,樂壇,らくだん
Gakuen Drama,学園ドラマ,がくえんどらま
Gakuen Symphony,学園シンフォニー,がくえんしんふぉにー
Gakuposan Watashi wa Daikiraidesu,がくぽさん 私は大嫌いです,がくぽさんわたしはだいきらいです
Gakurei janakute Tomodachi ga Hoshii,学歴じゃなくて友達がほしい,がくれきじゃなくてともだちがほしい
Galaco★Chic,ギャラ子★チック,ぎゃらこちっく
Galapagos de Warui ka,ガラパゴスで悪いか,がらぱごすであくいか
Galaxy Express 999,銀河鉄道999,ぎんがてつどうすりーないん
Galaxy Express 999,銀河鉄道999,ぎんがてつどうすりーないん
Galaxy Express 999,銀河鉄道999,ぎんがてつどうすりーないん
Galaxy Express 999,銀河鉄道999,ぎんがてつどうすりーないん
Galaxy Express 999,銀河鉄道999,ぎんがてつどうすりーないん
Galaxy Express 999,銀河鉄道999,ぎんがてつどうすりーないん
Galaxy Express,銀河特急,ぎんがとっきゅう
Galaxy Express,銀河特急,ぎんがとっきゅう
Galaxy Stairway,星路,せいじ
Galaxy Stairway,星路,せいじ
Galaxy,銀河,ぎんが
Galileo no Umi,ガリレオの海,がりれおのうみ
Gam Sang Jyu Mung,今生如夢,こんじょう如夢
Gam Sang Jyu Mung,今生如夢,こんじょう如夢
Gam Sang Jyu Mung,今生如夢,こんじょう如夢
Gambare! Kincho Danuki,がんばれ!金長だぬき,がんばれきむちょうだぬき
Game Izon,ゲーム依存,げーむいぞん
Game Jikkyou Yoku Mitemasu.,ゲーム実況よくみてます。,げーむじっきょうよくみてます
Game no Juunin,ゲームの住人,げーむのじゅうにん
Gamen no mukō no uchū,画面の向こうの宇宙,がめんのむこうのうちゅう
Gamen no Mukou no Anata e,画面の向こうのあなたへ,がめんのむこうのあなたへ
Ganba Nippon Corona ni Makeruna Sekai,ガンバ日本コロナに負けるな世界,がんばにっぽんころなにまけるなせかい
Ganbalouisiana,頑張ルイジアナ,がんばりるいじあな
Ganbare! Shutchou Salary Man,がんばれ!出張サラリーマン,がんばれしゅっちょうさらりーまん
Ganbaru Kimi E,頑張るキミへ,がんばるきみへ
Gangubako,玩具箱,おもちゃばこ
Ganmen Kurisumasu Cake,顔面クリスマスケーキ,がんめんくりすますけーき
Gao-San Shui,高三税,たかさんみつぐ
Garage Kakumei,ガレージ革命,がれーじかくめい
Garakuta Asobi,瓦落多遊び,かわらおちたあそび
Garakuta Billy no Mita Yume,がらくたビリーの見た夢,がらくたびりーのみたゆめ
Garakuta Hime to Apostrophe,ガラクタ姫とアポストロフ,がらくたひめとあぽすとろふ
Garakuta Hime to Apostrophe,ガラクタ姫とアポストロフ,がらくたひめとあぽすとろふ
Garakuta Innocence,我楽多イノセンス,がらくおおいのせんす
Garakuta Innocence,我楽多イノセンス,がらくおおいのせんす
Garakuta Machi no Android,ガラクタ街のアンドロイド,がらくたがいのあんどろいど
Garandou Interstellar,伽藍堂インタステラ,がらんどういんたすてら
garasu no kyojin x yatsume ana,ガラスの巨人 × ヤツメ穴,がらすのきょじんかけるやつめあな
Garasu Tsukuri no Hakoniwa,硝子造りの箱庭,がらすづくりのはこにわ
Garasudo no Naka,硝子戸の中,がらすどのうち
Garasuiro no Iris,硝子色のアイリス,がらすしょくのあいりす
Garden Balsam,鳳仙花,ほうせんかはな
Garden of Zion,シオンの園,しおんのえん
Garden,庭園,ていえん
Gas tomerareta techno,ガス止められたテクノ,がすとめられたてくの
GASSHO,合掌,がっしょう
gasu no motosen,あー♡ガスの元栓,あーがすのもとせん
Gatchaman no Uta,ガッチャマンの歌,がっちゃまんのうた
Gatchaman no Uta,ガッチャマンの歌,がっちゃまんのうた
Gatchaman no Uta,ガッチャマンの歌,がっちゃまんのうた
Gatchaman no Uta,ガッチャマンの歌,がっちゃまんのうた
Gate Time,継続時間,けいぞくじかん
Gatling,加特林,かとくりん
Gatsu no Ito,月の糸,つきのいと
Gaze pain,多感傷客観症,たかんしょうきゃっかんしょう
Gde tvoja golova,Где твоя голова,Гдетвояголова
Ge ni Utsukushiki Mikazuki,げに美しき三日月,げにうつくしきみかづき
Ge Ping zhi Ge,葛平之歌,くずひらのうた
Ge Sou Ya,月想夜,つきそうよる
Ge Sou Ya,月想夜,つきそうよる
Ge Sou Ya,月想夜,つきそうよる
Ge Sou Ya,月想夜,つきそうよる
Ge Sou Ya,月想夜,つきそうよる
Ge-kka Ran-bu,月花乱舞,げっからんぶ
Gebana,夏花,なつはな
Gebana,夏花,なつはな
Gedou Land e Youkoso,外道ランドへようこそ,げどうらんどへようこそ
Gedoushiki Soudanshitsu ni Youkoso. 100 Percent Onayami Kaiketsu,外道式相談室にようこそ。100パーお悩み解決,げどうしきそうだんしつにようこそぱーおなやみかいけつ
Geesen-jou no Aria,ゲーセン上のアリア,げーせんじょうのありあ
Geesen-jou no Aria,ゲーセン上のアリア,げーせんじょうのありあ
Geesen-jou no Aria,ゲーセン上のアリア,げーせんじょうのありあ
Geesen-jou no Aria,ゲーセン上のアリア,げーせんじょうのありあ
Geesen-jou no Aria,ゲーセン上のアリア,げーせんじょうのありあ
Gegege no Kiritanrou,ゲゲゲの鬼り太ん郎,げげげのおにりふとんろう
Gegen no Tsuki ni Utau Towa o,下弦の月に詠う永久を,かげんのつきにうたうえいきゅうを
Geki! Tei ~Saishuushou~,檄!帝ー最終章ー,げきみかどーさいしゅうしょうー
Gekidan Malyutka,劇団マリュートカ,げきだんまりゅーとか
Gekijou Alex,激情アレックス,げきじょうあれっくす
Gekijou no Riibe,劇場のリーベ,げきじょうのりーべ
Gekijou Regret,激情リグレット,げきじょうりぐれっと
Gekijou Torajedii,激情トラジェディー,げきじょうとらじぇでぃー
Gekijou Torajedii,激情トラジェディー,げきじょうとらじぇでぃー
Gekimetsu Viva Rock,撃滅ビバロック,げきめつびばろっく
Gekisou no Arcadia,激奏のアルカディア,げきそうのあるかでぃあ
Gekisou no Arcadia,激奏のアルカディア,げきそうのあるかでぃあ
Gekitsuu Dark Milk,激痛ダークミルク,げきつうだーくみるく
Gekiyaku Transistor,劇薬トランジスタ,げきやくとらんじすた
Gekka Bijin,月下美刃,げっかびは
Gekka Jasmine,月下ジャスミン,げっかじゃすみん
Gekka Meiran,月下命乱,つきかめいらん
Gekka no Hime Uta ~kurenai~,月花ノ姫歌 ~紅~,げっかのひめかべに
Gekka no Hime Uta ~kurenai~,月花ノ姫歌 ~紅~,げっかのひめかべに
Gekka no Tomoshibi,月花之灯,げっかのあかり
Gekka no Tsurugi to Tasogare no Yume,月下の剣と黄昏の夢,げっかのけんとたそがれのゆめ
Gekka Renjo,月華恋情,げっかれんじょう
Gekka Suimoku,月下睡黙,げっかねむだま
Gekkou Beach,月光ビーチ,げっこうびーち
Gekkou Drops,月光ドロップス,げっこうどろっぷす
Gekkou Insomnia,月光インソムニア,げっこういんそむにあ
Gekkou Junshoku Girl,月光潤色ガール,げっこうじゅんしょくがーる
Gekkou Junshoku Girl,月光潤色ガール,げっこうじゅんしょくがーる
Gekkou Music,月光ミュージック,げっこうみゅーじっく
Gekkou no Waltz,月虹のワルツ,げっこうのわるつ
Gekkou Noctambule,月光ノクタンブル,げっこうのくたんぶる
Gekkou Rhapsody,月光ラプソディ,げっこうらぷそでぃ
Gekkou Stage,月光ステージ,げっこうすてーじ
Gekkou Stage,月光ステージ,げっこうすてーじ
Gekkou Stage,月光ステージ,げっこうすてーじ
Gekkou Stage,月光ステージ,げっこうすてーじ
Gekkou Symphonia,月光シンフォニア,げっこうしんふぉにあ
Gekkou Total Eclipse,月光トータルイクリプス,げっこうとーたるいくりぷす
Gekkou Total Eclipse,月光トータルイクリプス,げっこうとーたるいくりぷす
Gekkou Total Eclipse,月光トータルイクリプス,げっこうとーたるいくりぷす
Gekkou Transfer,月光トランスファー,げっこうとらんすふぁー
Gekkou,月紅,つきべに
Gekkouki,月光姫,げっこうひめ
Gekkoushin,月交信,つきこうしん
Gekkoutou,月光燈,げっこうあかり
Gekkuu no Tabibito,月空の旅人,つきそらのたびびと
Gekkuu no Tabibito,月空の旅人,つきそらのたびびと
Gekokujou (Tai),下剋上(替),げこくじょうかわ
Gekokujou (Tai),下剋上(替),げこくじょうかわ
Gekokujou (Tai),下剋上(替),げこくじょうかわ
Gelände ga Tokeru hodo Koishitai,ゲレンデがとけるほど恋したい,げれんでがとけるほどこいしたい
Gelände no Joou,ゲレンデの女王,げれんでのじょおう
Geminid,ふたご座流星群,ふたござりゅうせいぐん
Gen'ei Hospital,幻影ホスピタル,げんえいほすぴたる
Gen'ei Labyrinth,幻影ラビリンス,げんえいらびりんす
Gen'ei Phaser,幻影フェイザー,げんえいふぇいざー
Gen'ei Phlogiston,幻影フロギストン,げんえいふろぎすとん
Gen'ei Shoujo (Mirage Doll),幻影少女(ミラージュ・ドール),げんえいしょうじょみらーじゅどーる
Gen'en,幻宴,まぼろしえん
Gen'in wa Shoujo,原因は少女,げんいんはしょうじょ
Genchou Distortion,幻聴ディストーション,げんちょうでぃすとーしょん
Gendai Hades,現代ハデス,げんだいはです
Gendai Shippei Toshi Kansha,現代疾病都市患者,げんだいしっぺいとしかんじゃ
Genei no Machi,幻影の街,げんえいのまち
Genei Paranoid,幻影ハ?ラノイト?,げんえいはらのいと
Generic Anime (Opening) Song,一般的なアニメの歌,いっぱんてきなあにめのうた
Generic Anime (Opening) Song,一般的なアニメの歌,いっぱんてきなあにめのうた
Genesis,伊始,いはじめ
Genesis,伊始,いはじめ
Gengai no Chuu,言外の註,げんがいの註
Genius Syndrome,天才シンドローム,てんさいしんどろーむ
Genjitsu Allergy,現実アレルギー,げんじつあれるぎー
Genjitsu Game,現実ゲーム,げんじつげーむ
Genjitsu Nonfiction,現実ノンフィクション,げんじつのんふぃくしょん
Genjitsu≠Mousou Discussion,現実≠妄想ディスカッション,げんじつもうそうでぃすかっしょん
Genjou Iji Bias,現状維持バイアス,げんじょういじばいあす
Genkai Disclosure,限界ディスクロージャー,げんかいでぃすくろーじゃー
Genkai Kakurenbo,幻界かくれんぼ,まぼろしかいかくれんぼ
Genkai Life Game,限界ライフゲーム,げんかいらいふげーむ
Genkai Truck,限界トロッコ,げんかいとろっこ
Genkai Waltz,限界ワルツ,げんかいわるつ
Genkaku Jinsei ~Mofu Mofu,幻覚人生ーもふもふ,げんかくじんせいーもふもふ
Genkaku Katasutorofii,幻覚カタストロフィー,げんかくかたすとろふぃー
Genkaku Rabbit,幻覚ラビット,げんかくらびっと
Genkaku Shoujo to Kami-sama no Kotoba,幻覚少女と神様の言葉,げんかくしょうじょとかみさまのことば
Genki no Kyoshokushou,元気な拒食症,げんきなきょしょくしょう
Genki o Wakete Agerareru you ni,元気を分けてあげられるように,げんきをわけてあげられるように
Genki,眩輝,まばゆてる
Genkibushi,元気節,もときせつ
Genkyoushoujyo,元凶少女,げんきょうしょうじょ
Genmetsu no Chocolate Doll,幻滅のチョコレートドール,げんめつのちょこれーとどーる
Genmu Days,言無デイズ,げんむでいず
Genmu Days,言無デイズ,げんむでいず
Genmu Juon Shikonsou,幻夢呪怨死魂葬,まぼろしゆめじゅおんさほんそう
Gense Strike,現世ストライキ,げんせいすとらいき
Gensei Ghost Kyomu Kakure,現世ゴオスト虚無隠レ,げんせいごおすときょむかくれ
Gensei wa Jigoku,現世は地獄,げんせいはじごく
Genshou Heat Island​,現象ヒートアイランド,げんしょうひーとあいらんど
Genshou Rakuen,幻葬楽園,まぼろしそうらくえん
Genshou Rakuen,幻葬楽園,まぼろしそうらくえん
Genso Shuukihyou no Oboe Uta,元素周期表の覚え歌,げんそしゅうきひょうのおぼえか
Gensō Yume,幻想夢,げんそうゆめ
Gensou Alice,幻奏アリス,まぼろしそうありす
Gensou Alice,幻想アリス,げんそうありす
Gensou Dystopia,幻想ディストピア,げんそうでぃすとぴあ
Gensou Film,幻想フィルム,げんそうふぃるむ
Gensou Hero,幻想ヒーロー,げんそうひーろー
Gensou Märchen,幻奏メルヒェン,まぼろしそうめるひぇん
Gensou Masshou Blade,幻想抹消ブレイド,げんそうまっしょうぶれいど
Gensou no Berry Doll,幻想のベリードール,げんそうのべりーどーる
Gensou no Linaria,幻想のリナリア,げんそうのりなりあ
Gensou no Maroudo,幻想の客人,げんそうのきゃくじん
Gensou Pianist,幻想ピアニスト,げんそうぴあにすと
Gensou Pianist,幻想ピアニスト,げんそうぴあにすと
Gensou Pianist,幻想ピアニスト,げんそうぴあにすと
Gensou Refrain,幻想リフレイン,げんそうりふれいん
Gensou Roman Kikou,幻想浪漫綺行,げんそうろうまんあやぎぬくだり
Gensou Satisfaction,幻奏サティスファクション,まぼろしそうさてぃすふぁくしょん
Gensou Shima Neko no Uta,幻想島ねこのうた,げんそうとうねこのうた
Gensou Thanatos,幻葬タナトス,まぼろしそうたなとす
Gensou Utopia,幻想ユートピア,げんそうゆーとぴあ
Gensou Yuugen Shounen,幻想誘現少年,げんそう誘現しょうねん
Gensouka,幻奏歌,まぼろしかなう
Gensouka,幻奏歌,まぼろしかなう
Gensouka,幻奏歌,まぼろしかなう
Gensouka,幻奏歌,まぼろしかなう
Gensouka,幻奏歌,まぼろしかなう
Gensouka,幻奏歌,まぼろしかなう
Gentle Moment,やさしい時間,やさしいじかん
Gentou Muyuu,幻灯夢遊,げんとうゆめゆう
Gentou Zakura,玄冬桜,げんふゆざくら
Gentouya,幻燈夜,げんとうよる
Gentsu Requiem,幻痛レクイエム,まぼろしつうれくいえむ
Genzai to Mirai no Dilemma,原罪と未来のジレンマ,げんざいとみらいのじれんま
Genzai to Mirai no Dilemma,原罪と未来のジレンマ,げんざいとみらいのじれんま
Geppaku,月白,つきしろ
Gera Gera Boo no Uta,ゲラゲラポーの歌,げらげらぽーのうた
Gesheng yu Weixiao,歌声与微笑,うたごえあずかびしょう
Geshi Minamikaze no Hito,夏至南風の人,かーちーべーのひと
Gessekai Parade,月世界パレード,げっせかいぱれーど
Gessen,月船,つきせん
Gesshoku Noise to Neverland,月色ノイズとネヴァーランド,げっしょくのいずとねゔぁーらんど
Gessouka,月想歌,つきそう
Gessouya,月想夜,つきそうよる
Gestalt no Inu,ゲシュタルトの犬,げしゅたるとのいぬ
Gestalt Seisei,ゲシュタルト生成,げしゅたるとせいせい
Get to know people and know yourself,人を知り 自分を知る,ひとをしりじぶんをしる
Getabako no Love Letter,下駄箱のラブレター,げたばこのらぶれたー
Getemono,下手者,へたしゃ
Getsuei,月影,つきかげ
Getsumen Dandelion,月面ダンデライオン,げつめんだんでらいおん
Getsumen Diary,月面ダイアリー,げつめんだいありー
Getsumen Diary,月面ダイアリー,げつめんだいありー
Getsumen Tansa-ki! Kaguya-hime,月面探査機!かぐや姫,げつめんたんさきかぐやひめ
Getsumen-jo no Pianist,月面上のピアニスト,げつめんじょうのぴあにすと
Getsumen-jo no Pianist,月面上のピアニスト,げつめんじょうのぴあにすと
Getsusekai Ryokou,月世界旅行,げっせかいりょこう
Getsuyoubi o Fukitobase,月曜日をふきとばせ,げつようびをふきとばせ
getting colder,寒くなる,さむくなる
Getting Depressed and Depressed,だんだん鬱になっていく,だんだん鬱になっていく
Getto no Yashiro,月兎の社,つきうさぎのしゃ
Ghast Tear,ガストの涙,がすとのなみだ
Ghast Tear,ガストの涙,がすとのなみだ
Ghost City Tokyo,幽霊東京,ゆうれいとうきょう
Ghost City Tokyo,幽霊東京,ゆうれいとうきょう
Ghost City Tokyo,幽霊東京,ゆうれいとうきょう
Ghost City Tokyo,幽霊東京,ゆうれいとうきょう
Ghost Girl,少女レイ,しょうじょれい
Ghost Letter wa Sorairo de,ゴーストレターは空色で,ごーすとれたーはそらいろで
Ghost Supplement -A Lethal Dose of Sadness-,ゴーストサプリ -セツナサの致死量-,ごーすとさぷりせつなさのちしりょう
Ghost Supplement -Reality-,ゴーストサプリ -現実-,ごーすとさぷりげんじつ
Ghost Supplement -Yokohama Jisatsu Biyori-,ゴーストサプリ -横浜自殺日和-,ごーすとさぷりよこはまじさつひより
Ghost Supplement Episode 1,ゴーストサプリ 第1話 -正夢-,ごーすとさぷりだいいちわまさゆめ
Ghost Supplement Episode 2,ゴーストサプリ 第2話 -副作用-,ごーすとさぷりだいにわふくさよう
Ghost,幽霊,ゆうれい
Ghost,幽霊,ゆうれい
Gi,疑,うたぐ
Gi,義,よし
Gift from the princess who brought sleep,眠らせ姫からの贈り物,ねむらせひめからのおくりもの
Gijie,擬似餌,ぎじえさ
Gijin no Eve,擬人のイヴ,ぎじんのいゔ
Gijinka ☆ Love Couple,擬人化☆ラブカップル,ぎじんからぶかっぷる
Gikaku Sensitive,偽赫センシティブ,にせてらしせんしてぃぶ
Gikyokuteki Realism,戯曲的リアリズム,ぎきょくてきりありずむ
Giman - Disable,欺瞞-ディスエイブル,ぎまんでぃすえいぶる
Gimlet de Owakare o,ギムレットでお別れを,ぎむれっとでおわかれを
Gimlet no Raise,ギムレットの来世,ぎむれっとのらいせ
Gimlet no Raise,ギムレットの来世,ぎむれっとのらいせ
Gin Kitsune,銀狐,ぎんぎつね
Gin no Fruit,銀のフルーフ,ぎんのふるーふ
Gin no Fruit,銀のフルーフ,ぎんのふるーふ
Gin no Fruit,銀のフルーフ,ぎんのふるーふ
Gin no Fruit,銀のフルーフ,ぎんのふるーふ
gin no mori wa yoru ni kagayaku,銀の森は夜に輝く,ぎんのもりはよるにかがやく
Gin no Pulse,銀のパルス,ぎんのぱるす
Gin'iro Lagrange,銀色ラグランジュ,ぎんいろらぐらんじゅ
Gin'iro no Message,銀色のメッセージ,ぎんいろのめっせーじ
Gin'irogumo,銀色雲,ぎんいろくも
Ginga e no Basha,銀河への馬車,ぎんがへのばしゃ
Ginga e,銀河へ,ぎんがへ
Ginga Rendezvous,銀河ランデヴー,ぎんがらんでゔー
Ginga Testudou wa Yoru no Machi ni,銀河鉄道は夜の街に,ぎんがてつどうはよるのまちに
Ginga Tetsudō 999,銀河鉄道999,ぎんがてつどうすりーないん
Ginga Tetsudō 999,銀河鉄道999,ぎんがてつどうすりーないん
Ginga Tetsudō 999,銀河鉄道999,ぎんがてつどうすりーないん
Ginga Tetsudō 999,銀河鉄道999,ぎんがてつどうすりーないん
Ginga Tetsudō 999,銀河鉄道999,ぎんがてつどうすりーないん
Ginga Tetsudō 999,銀河鉄道999,ぎんがてつどうすりーないん
Ginga Tetsudō 999,銀河鉄道999,ぎんがてつどうすりーないん
Ginga Tetsudō 999,銀河鉄道999,ぎんがてつどうすりーないん
Ginga Tetsudō 999,銀河鉄道999,ぎんがてつどうすりーないん
Ginga Tetsudō 999,銀河鉄道999,ぎんがてつどうすりーないん
Ginga Tetsudō 999,銀河鉄道999,ぎんがてつどうすりーないん
Ginga Tetsudō 999,銀河鉄道999,ぎんがてつどうすりーないん
Ginga Tetsudō 999,銀河鉄道999,ぎんがてつどうすりーないん
Ginga Tetsudō 999,銀河鉄道999,ぎんがてつどうすりーないん
Ginga Tetsudō 999,銀河鉄道999,ぎんがてつどうすりーないん
Ginga Tetsudō 999,銀河鉄道999,ぎんがてつどうすりーないん
Ginga Tetsudō 999,銀河鉄道999,ぎんがてつどうすりーないん
Ginga Tetsudō 999,銀河鉄道999,ぎんがてつどうすりーないん
Ginga Tetsudō 999,銀河鉄道999,ぎんがてつどうすりーないん
Ginga Tetsudō 999,銀河鉄道999,ぎんがてつどうすりーないん
Ginga Tetsudou 999,銀河鉄道999,ぎんがてつどうすりーないん
Ginga Tetsudou 999,銀河鉄道999,ぎんがてつどうすりーないん
Ginga Tetsudou 999,銀河鉄道999,ぎんがてつどうすりーないん
Ginga Tetsudou 999,銀河鉄道999,ぎんがてつどうすりーないん
Ginga Tetsudou to Cinderella,銀河鉄道とシンデレラ,ぎんがてつどうとしんでれら
Ginga to Happy End,銀河とハッピーエンド,ぎんがとはっぴーえんど
Gingakei kara Toho 5-fun Inai de,銀河系から徒歩5分以内で,ぎんがけいからとほごふんいないで
Gingateki ☆ Cosmo Parade!,銀河的☆こすもぱれぃど!,ぎんがてきこすもぱれぃど
Ginger no Majo,ジンジャーの魔女,じんじゃーのまじょ
Gingetsu Sakana no Yoru,銀月魚の夜,ぎんげつぎょのよる
Giniro No Ondo,銀色の温度,ぎんいろのおんど
Ginka Hourou Mirror Twins,銀河放浪ミラーツインズ,ぎんがほうろうみらーついんず
Ginka,銀花,ぎんはな
Ginkou Goutou Fantastic,銀行強盗ファンタスティック,ぎんこうごうとうふぁんたすてぃっく
Ginmaku Twilight,銀幕トワイライト,ぎんまくとわいらいと
Ginrin wa Utau,銀輪は唄う,ぎんりんはうたう
Ginsei no Artemis,銀聖のアルテミス,ぎんせいのあるてみす
Ginsetsu no Koi,銀雪の恋,しろがねゆきのこい
Ginsetsu,銀雪,しろがねゆき
Ginzetsu Enmu,銀雪焔夢,しろがねゆきほのおゆめ
Gion Zakura,祇園櫻,ぎおんさくら
Gipnoza,гипноза,гипноза
Girl On Fire,廢墟少女,廢墟しょうじょ
Girl Who Tends to Look Downcast,伏目がちな少女,ふしめがちなしょうじょ
Girl's Revolution,少女革命,しょうじょかくめい
Girl's toy,少女的玩具,しょうじょてきおもちゃ
Girlish City,乙女チック・シティ,おとめちっくしてぃ
Girlish City,乙女チック・シティ,おとめちっくしてぃ
Girlving to the Right,右に曲ガール,みぎにきょくがーる
Giseisha,偽生者,にせしょうじゃ
Gishin no Birthday,疑心のバースデイ,ぎしんのばーすでい
Gishin'angi kuesuto,疑心暗鬼クエスト,ぎしんあんきくえすと
Gishin'anki,疑神暗鬼,うたぐかみあんき
Gishinanki,疑心暗鬼,ぎしんあんき
Gishinanki,疑心暗鬼,ぎしんあんき
Gishinanki,疑心暗鬼,ぎしんあんき
Gishinanki,疑心暗鬼,ぎしんあんき
Gishinanki,疑心暗鬼,ぎしんあんき
Gishinanki,疑心暗鬼,ぎしんあんき
Gishinanki,疑心暗鬼,ぎしんあんき
Gishinanki,疑心暗鬼,ぎしんあんき
Gishinanki,疑心暗鬼,ぎしんあんき
Gishinanki,疑心暗鬼,ぎしんあんき
Gishinanki,疑心暗鬼,ぎしんあんき
Gishinanki,疑心暗鬼,ぎしんあんき
Gishinanki,疑心暗鬼,ぎしんあんき
Gishinanki,疑心暗鬼,ぎしんあんき
Gishokugai,偽色街,にせいろまち
gita-syoujo,ギター少女,ぎたーしょうじょ
Give Me a Letter,御手紙頂戴,おてがみちょうだい
Giyoku,義翼,ぎつばさ
Giza Giza Heart no Funeuta,ギザギザハートの舟歌,ぎざぎざはーとのふなうた
Giza Giza Ringo no Komori-uta,ギザギザリンゴの子守唄,ぎざぎざりんごのこもりうた
Gizen Justice,偽善正義,ぎぜんまさよし
Gizensha Rhapsody,偽善者ラプソディー,ぎぜんしゃらぷそでぃー
Glacier,暮色冰川,ぼしょくひょうがわ
