Kudou yori,空洞より,くうどうより
Kudryavka,Кудрявка,Кудрявка
Kuge to Haiga,供花と胚芽,きょうかとはいが
Kugi Bat Gang no Nichijou~Shimokitahen~,釘バットギャングの日常ー下北編ー,くぎばっとぎゃんぐのにちじょうーしもきたへんー
Kugutsu no Kotodama,傀儡の言靈,かいらいのげん靈
Kugutsu,傀儡,かいらい
Kuhaku Kisetsu,空白季説,くうはくきせつ
kuhaku,空白,くうはく
Kuishinbou  no Rhapsody,食いしん坊のラプソディ,くいしんぼうのらぷそでぃ
Kuishinbou no Rhapsody,食いしん坊のラプソディ,くいしんぼうのらぷそでぃ
Kujira kouen no shashin-ka,くじら公園の写真家,くじらこうえんのしゃしんか
Kujira no Seichi no Bohyoo,鯨の聖地の墓標,くじらのせいちのぼひょう
Kujira no Uchuu Rocket,クジラの宇宙ロケット,くじらのうちゅうろけっと
Kukushka,Кукушка,Кукушка
Kukushka,Кукушка,Кукушка
Kumano no Kodou,熊野の古道,くまののふるみち
Kumikyoku [Spain],組曲[スペイン],くみきょくすぺいん
Kumikyoku Nico Nico Douga [Kanbu~Chouchou],組曲『ニコニコ動画』「患部ー蝶々」 ,くみきょくにこにこどうがかんぶーちょうちょう
Kumikyoku Nico Nico Douga [Tokachi~Hare Hare],組曲『ニコニコ動画』「十勝ー晴レ晴レ」,くみきょくにこにこどうがとかちーはれはれ
Kumikyoku Nico Nico Douga ~Jo~,組曲『ニコニコ動画』ー序ー,くみきょくにこにこどうがーじょー
Kumikyoku Nico Nico Douga,組曲「ニコニコ動画」,くみきょくにこにこどうが
Kumikyoku Nico Nico Douga,組曲「ニコニコ動画」,くみきょくにこにこどうが
Kumikyoku Nico Nico Douga,組曲「ニコニコ動画」,くみきょくにこにこどうが
Kumikyoku Nico Nico Douga,組曲「ニコニコ動画」,くみきょくにこにこどうが
Kumikyoku Nico Nico Douga,組曲『ニコニコ動画』,くみきょくにこにこどうが
Kumikyoku Nico Nico Douga,組曲『ニコニコ動画』,くみきょくにこにこどうが
Kumikyoku Nico Nico Douga,組曲『ニコニコ動画』,くみきょくにこにこどうが
Kumikyoku Nico Nico Douga,組曲『ニコニコ動画』,くみきょくにこにこどうが
Kumikyoku Nico Nico Douga,組曲『ニコニコ動画』,くみきょくにこにこどうが
Kumikyoku Nico Nico Douga,組曲『ニコニコ動画』,くみきょくにこにこどうが
Kumikyoku Nico Nico Douga,組曲『ニコニコ動画』,くみきょくにこにこどうが
Kumikyoku Nico Nico Douga,組曲『ニコニコ動画』,くみきょくにこにこどうが
Kumo Ito Monopoly,蜘蛛糸モノポリー,くもいとものぽりー
Kumo Ito Monopoly,蜘蛛糸モノポリー,くもいとものぽりー
Kumo o Tsukamu,雲をつかむ,くもをつかむ
Kumo wa Yuukibutsu,雲は有機物,くもはゆうきぶつ
kumo,雲 超ロングエディション,くもちょうろんぐえでぃしょん
Kumoito Monopoly,蜘蛛糸モノポリー,くもいとものぽりー
Kumori Glass,曇りガラス,くもりがらす
Kumorinochi Ame Demo Kitto Hareru wa,曇りのち雨でもきっと晴れるわ,くもりのちうでもきっとはれるわ
Kung Fu Shoujo wa Mae wo Muku,カンフー少女は前を向く,かんふーしょうじょはまえをむく
Kuniko no Theme,邦子のテーマ,くにこのてーま
Kunoichi Omayu Nin Houjou,くノ一お繭忍法帖,くのいちおまゆにんぽうちょう
Kunoichi Shinobigatari,くノ一忍語,くのいちにんご
Kunshi Ayauku mo Chikau Yore,君氏危うくも近うよれ,くんしあやうくもちこうよれ
Kunshou,君証,きみしょう
Kuon Kagura,久遠神楽,くどおかぐら
Kuragari no Tunnel,暗がりのトンネル,くらがりのとんねる
Kuragari Paradox,暗がりパラドックス,くらがりぱらどっくす
Kuragegumo,海月雲,くらげくも
Kurai Mori no Circus,暗い森のサーカス,くらいもりのさーかす
Kurai Mori no Circus,暗い森のサーカス,くらいもりのさーかす
Kurai Mori no Circus,暗い森のサーカス,くらいもりのさーかす
Kurai Mori no Circus,暗い森のサーカス,くらいもりのさーかす
Kurai Mori no Circus,暗い森のサーカス,くらいもりのさーかす
Kurai Mori no Circus,暗い森のサーカス,くらいもりのさーかす
Kurai Mori no Circus,暗い森のサーカス,くらいもりのさーかす
Kurai Mori no Circus,暗い森のサーカス,くらいもりのさーかす
Kurai Mori no Circus,暗い森のサーカス,くらいもりのさーかす
Kurai Mori no Circus,暗い森のサーカス,くらいもりのさーかす
Kurai Mori no Circus,暗い森のサーカス,くらいもりのさーかす
Kurai Mori no Circus,暗い森のサーカス,くらいもりのさーかす
Kurai Mori,幽い森,かそけいもり
Kurakami Shoujo Tai,黒髪少女態,くろかみしょうじょたい
Kuraku Fukai Mori,昏く深い森,昏くふかいもり
Kuraku Narenai Utsutachi no Uta,暗くなれない鬱たちの唄,くらくなれない鬱たちのうた
Kuramu Bokura wa Giman no Yoru ni,眩む僕らは欺瞞の夜に,くらむぼくらはぎまんのよるに
Kurasuruumu no Boukansha,クラスルームの傍観者,くらするーむのぼうかんしゃ
Kurayami Carnival,暗闇カーニバル,くらやみかーにばる
Kurayami Carnival,暗闇カーニバル,くらやみかーにばる
Kurayami Ginger Ale,暗闇ジンジャーエール,くらやみじんじゃーえーる
Kurayami Love Song,暗闇ラブソン,くらやみらぶそん
Kurayami no Parade,暗闇のパレード,くらやみのぱれーど
Kurayami no Parade,暗闇のパレード,くらやみのぱれーど
Kurayami o Suikomu,暗闇を吸い込む,くらやみをすいこむ
Kurayami Sekai no Yuusetsu,くらやみ世界の幽雪,くらやみせかいのかそけゆき
Kurenai Chou,紅蝶,べにちょう
Kurenai no Chikai,紅の誓い,べにのちかい
Kurenai no Hana,紅の花,べにのはな
Kurenai no Hoshi,紅の星,べにのほし
Kurenai no Kioku,紅の記憶,べにのきおく
Kurenai no Oni,紅の鬼,べにのおに
Kurenai no Oni,紅の鬼,べにのおに
Kurenai no Tsuki ~Kuruka~,紅ノ月 ー狂華ー,べにのつきーきょうはなー
Kurenai no Tsuki,紅ノ月,べにのつき
Kurenai to Ruri,紅と瑠璃,べにとるり
Kurenai to Ruri,紅と瑠璃,べにとるり
Kurenai,紅,べに
Kurenaii Shirayuri,紅イ白百合,べにいしらゆり
Kurikaeshi Hitotsubu,繰り返し一粒,くりかえしいちつぶ
Kurikaeshi Hitotsubu,繰り返し一粒,くりかえしいちつぶ
Kurikaeshi Hitotsubu,繰り返し一粒,くりかえしいちつぶ
Kurikaeshi Hitotsubu,繰り返し一粒,くりかえしいちつぶ
Kurikaeshi Hitotsubu,繰り返し一粒,くりかえしいちつぶ
Kurikaeshi Hitotsubu,繰り返し一粒,くりかえしいちつぶ
Kurikaeshi Hitotsubu,繰り返し一粒,くりかえしいちつぶ
Kurikaeshi Hitotsubu,繰り返し一粒,くりかえしいちつぶ
Kurikaeshi Hitotsubu,繰り返し一粒,くりかえしいちつぶ
Kurikaeshi Hitotsubu,繰り返し一粒,くりかえしいちつぶ
Kurikaeshi Hitotsubu,繰り返し一粒,くりかえしいちつぶ
Kurisumasu Ivu no Yoru ni -Fushiawase Saido-,クリスマスイヴの夜に -不幸せサイド-,くりすますいゔのよるにふしあわせさいど
Kuro Alice,黒アリス,くろありす
Kuro Ame no Hate ni,黒雨の果てに,くろうのはてに
Kuro ga Shiro to Shoujo Tachi no Metaphor,黒が白と少女達のメタファー,くろがしろとしょうじょたちのめたふぁー
Kuro kutsushita shokogun,黒靴下症候群,くろくつしたしょうこうぐん
Kuro kutsushita shokogun,黒靴下症候群,くろくつしたしょうこうぐん
Kuro neko no burusu,黒猫のブルース,くろねこのぶるーす
Kuro ni oboreru,黒に溺ねる,くろに溺ねる
Kuro no Canvas,黒のキャンバス,くろのきゃんばす
Kuro no Ether,黒のエーテル ,くろのえーてる
Kuro No Gekko,黒の月光,くろのげっこう
Kuro no ryūshi,黒の粒子,くろのりゅうし
Kuro no Waltz,黒のワルツ,くろのわるつ
Kuro Rabbit Dropout,黒ラビ・ドロップアウト,くろらびどろっぷあうと
Kuro Rabbit Dropout,黒ラビ・ドロップアウト,くろらびどろっぷあうと
Kuro Utage,黒宴 ーくろうたげー,くろえんーくろうたげー
Kuro Utage,黒宴 ーくろうたげー,くろえんーくろうたげー
Kurobara,黒薔薇,くろつばら
Kuroboshi Asteroid,黒星アステロイド,くろぼしあすてろいど
Kurobuchi Megane Girl,黒縁眼鏡ガール,くろぶちめがねがーる
Kuroda-bushi,黒田節,くろだぶし
kuroen,黑縁,黑縁
kurogane no hakobune,鐵の方舟,てつのはこぶね
Kuroge Wagyu Joshio Tanyaki 680,黒毛和牛上塩タン680円,くろげわぎゅうかみしおたんろっぴゃくはちじゅうえん
Kuroi Annai Neko,黒い案内猫,くろいあんないねこ
Kuroi Dress,黒いドレス,くろいどれす
Kuroi honoo no Salamander,黒い炎のサラマンダー,くろいほのおのさらまんだー
Kuroi Ink,黒いインク,くろいいんく
Kuroi Inu to Waltz o,黒い犬とワルツを,くろいいぬとわるつを
Kuroi Kanjoo,黒い感情,くろいかんじょう
Kuroi Koibitotachi no Pavement,黒い恋人たちの舗道,くろいこいびとたちのほどう
Kuroi myakudo,黒い脈動,くろいみゃくどう
Kuroi Sora o Nagamete,黒イ空ヲ眺メテ,くろいそらをながむめて
Kuroi taiyō,黒い太陽,くろいたいよう
Kuroi Taiyou Paradox,黒い太陽パラドックス,くろいたいようぱらどっくす
Kuroi Yoru no Owari ni Kaze wa Fuku,黒い夜の終わりに風は吹く,くろいよるのおわりにかぜはふく
Kurokami Legend,黒髪レジェンド,くろかみれじぇんど
Kurokami Legend,黒髪レジェンド,くろかみれじぇんど
Kurokami no Relato,黒髪のレラート,くろかみのれらーと
Kurokami no Relato,黒髪のレラート,くろかみのれらーと
Kuromaku wa Odoru,黒幕は踊る,くろまくはおどる
Kuroneko Darling,黒猫ダーリン,くろねこだーりん
Kuroneko Jack,黒猫ジャック,くろねこじゃっく
Kuroneko Jungle,黒猫ジャングル,くろねこじゃんぐる
Kuroneko Jungle,黒猫ジャングル,くろねこじゃんぐる
Kuroneko Midnight,黒猫ミッドナイト,くろねこみっどないと
Kuroneko Montage,黒猫モンタージュ,くろねこもんたーじゅ
Kuroneko no Bench,黒猫のベンチ,くろねこのべんち
Kuroneko no Merry Christmas,黒猫のメリークリスマス,くろねこのめりーくりすます
Kuroneko no Suspense,黒猫のサスペンス,くろねこのさすぺんす
Kuroneko no Vanilla,黒猫のバニラ,くろねこのばにら
Kuroneko Showtime,黒猫しょうたいむ,くろねこしょうたいむ
Kuroneko Shuffle,黒猫シャッフル,くろねこしゃっふる
Kuroshobi kamen dai undokai,黒薔薇仮面大運動会,くろつばらかめんだいうんどうかい
Kuroshobi kamen dai undokai,黒薔薇仮面大運動会,くろつばらかめんだいうんどうかい
Kuroshobi shojo,黒薔薇少女,くろつばらしょうじょ
Kuroyagi no Restaurant,黒山羊さんのレストラン,くろやぎさんのれすとらん
Kuroyuri Shoujo no Egoism,クロユリ少女のエゴイズム,くろゆりしょうじょのえごいずむ
Kuroyuri wa Sakanai,黒百合は咲かない,くろゆりはさかない
Kuru-beki Hi no Tame ni Boku wa Mainichi Sunege wo Soru,来るべき日のために僕は毎日スネ毛を剃る,きたるべきひのためにぼくはまいにちすねけをそる
Kuruenai Bokura wa,狂えない僕らは,きょうえないぼくらは
Kuruizaita Akai Hana,狂い咲いた赤い花,くるいさいたあかいはな
Kuruizaki Antithesis,狂い咲きアンチテーゼ,くるいざきあんちてーぜ
Kuruma no Naka de Kakurete Kiss wo Shiyou,車の中で隠れてキスをしよう,くるまのなかでかくれてきすをしよう
Kurumaisu no Kata wa Jizen Renraku ga Hitsuyou,車椅子の方は事前連絡が必要,くるまいすのほうはじせんれんらくがひつよう
Kururin Flower Ni-gou,くるりんフラワー 2号,くるりんふらわーにごう
Kurushiki laugh,苦しき笑い,くるしきわらい
Kurutta Douke wa Kage de Naku,狂った道化は影で泣く,くるったどうけはかげでなく
Kuruu Kemono,狂う獣,くるうしし
Kusabue o Fuite,草笛を吹いて,くさぶえをふいて
Kusare Saber Tiger no Kinako ni Tsutsumareru Cholesterol,腐れサーベルタイガーのきな粉に含まれるコレステロール,くされさーべるたいがーのきなこにふくまれるこれすてろーる
Kusaregedou to Chocolate,腐れ外道とチョコレゐト,くされげどうとちょこれゐと
Kusarincess Road,腐リンセスロード,くさりんせすろーど
Kusatta Mirror Ball,腐ったミラーボール,くさったみらーぼーる
Kusha no Sabaki,愚者の裁き,ぐしゃのさばき
Kushami Ga Scream De Deta,くしゃみがスクリームで出た,くしゃみがすくりーむででた
Kusoge Jikkyou Play,クソゲー実況プレイ,くそげーじっきょうぷれい
Kusoge Jikkyou Play,クソゲー実況プレイ,くそげーじっきょうぷれい
Kutabare!! Nico Nico Douga,くたばれ!!ニコニコ動画,くたばれにこにこどうが
Kutsu to bag to aku se,靴とバッグとアクセ,くつとばっぐとあくせ
Kutsushita Dake wa Nuganaide,靴下だけは脱がないで,くつしただけはぬがないで
Kutsuzoko Dark,靴底ダーク,くつぞこだーく
Kutsuzumi de Hamigaki,靴墨でハミガキ,くつづみではみがき
Kuu chu Planet,空宙プラネット,そらちゅうぷらねっと
Kuu chu Planet,空宙プラネット,そらちゅうぷらねっと
Kuuchi Yourotaku,空中楼閣,くうちゅうのろうかく
Kuuchuu Bungai,空中分解,くうちゅうぶんかい
Kuuchuu Bungai,空中分解,くうちゅうぶんかい
Kuuchuu Bungai,空中分解,くうちゅうぶんかい
Kuuchuu Bungai,空中分解,くうちゅうぶんかい
Kuuchuu Roukaku,空中楼閣,くうちゅうのろうかく
Kuuchuu Roukaku,空中楼閣,くうちゅうのろうかく
Kuuchuu Sneaker,空中スニーカー,くうちゅうすにーかー
Kuuchuu Theater,空中シアター,くうちゅうしあたー
Kuuhaku Hot Line,空白ホットライン,くうはくほっとらいん
Kuuhaku no Calendar,空白のカレンダー,くうはくのかれんだー
Kuuhaku no Last,空白のラスト,くうはくのらすと
Kuuhaku no Mask Marcia,空白のマスクマルシア,くうはくのますくまるしあ
Kuuhaku o Aruku,空白を歩く,くうはくをあるく
Kuujaku Desperation,空寂ディスプレッション,そらさびでぃすぷれっしょん
Kuukan Limit,空間リミット,くうかんりみっと
Kuukan,空棺,そらかん
Kuuki Knife,空気ナイフ,くうきないふ
Kuuki Knife,空気ナイフ,くうきないふ
Kuuron Hanten,九龍飯店,くーろんはんてん
Kuuron Hanten,九龍飯店,くーろんはんてん
Kuuron Hanten,九龍飯店,くーろんはんてん
Kuuron Idola,九龍イドラ,くーろんいどら
Kuuron Retro,九龍レトロ,くーろんれとろ
Kuuron Retro,九龍レトロ,くーろんれとろ
Kuuron Retro,九龍レトロ,くーろんれとろ
Kuushitsu,空室,あきしつ
Kuusou Compression,空想コンプレッション,くうそうこんぷれっしょん
Kuusou Crossroad,空想クロスロード,くうそうくろすろーど
Kuusou Destroy,空想デストロィ,くうそうですとろぃ
Kuusou Diorama Heart,空想ジオラマハート,くうそうじおらまはーと
Kuusou Fantasia,空奏ファンタジア,そらそうふぁんたじあ
Kuusou Fantasia,空奏ファンタジア,そらそうふぁんたじあ
Kuusou Fantasy,空想ファンタジー,くうそうふぁんたじー
Kuusou Fiction,空想フィクション,くうそうふぃくしょん
Kuusou Forest,空想フォレスト,くうそうふぉれすと
Kuusou Forest,空想フォレスト,くうそうふぉれすと
Kuusou Hierarchy,空想ヒエラルキー,くうそうひえらるきー
Kuusou Idealogy,空想イデオロギー,くうそういでおろぎー
Kuusou Idealogy,空想イデオロギー,くうそういでおろぎー
Kuusou Kaleidoscope,空想カレイドスコープ,くうそうかれいどすこーぷ
Kuusou Kamisama Album Version,空想神様 アルバムバージヨン,くうそうかみさまあるばむばーじよん
Kuusou Latency,空想レイテンシー,くうそうれいてんしー
Kuusou Memory,空想メモリ,くうそうめもり
Kuusou Mythology,空想メソロギヰ,くうそうめそろぎゐ
Kuusou Mythology,空想メソロギヰ,くうそうめそろぎゐ
Kuusou Mythology,空想メソロギヰ,くうそうめそろぎゐ
Kuusou Mythology,空想メソロギヰ,くうそうめそろぎゐ
Kuusou no Maracatu,空想のマラカトゥ,くうそうのまらかとぅ
Kuusou Palette,空想パレット,くうそうぱれっと
Kuusou Portal World,空想ポータルワールド,くうそうぽーたるわーるど
Kuusou Possibility,空想ポシビリティー,くうそうぽしびりてぃー
Kuusou Possibility,空想ポシビリティー,くうそうぽしびりてぃー
Kuusou Ressha,空奏列車,そらそうれっしゃ
Kuusou Ressha,空奏列車,そらそうれっしゃ
Kuusou Ressha,空奏列車,そらそうれっしゃ
Kuusou Ressha,空奏列車,そらそうれっしゃ
Kuusou Ressha,空奏列車,そらそうれっしゃ
Kuusou Ressha,空奏列車,そらそうれっしゃ
Kuusou Ressha,空奏列車,そらそうれっしゃ
Kuusou Ressha,空奏列車,そらそうれっしゃ
Kuusou Rumba,空想ルンバ,くうそうるんば
Kuusou Runaway,空想ラナウェイ,くうそうらなうぇい
Kuusou Sakka to Cappuccino,空想作家とカプチーノ,くうそうさっかとかぷちーの
Kuusou Shoujo e no Koitegami,空想少女への恋手紙,くうそうしょうじょへのこいてがみ
Kuusou Shoujo e no Koitegami,空想少女への恋手紙,くうそうしょうじょへのこいてがみ
Kuusou Shoujo Lonely Session,空想少女のロンリーセッション,くうそうしょうじょのろんりーせっしょん
Kuusou Starfall,空奏スターフォール,そらそうすたーふぉーる
Kuusou Supairaru Gaaru,空想スパイラルガール,くうそうすぱいらるがーる
Kuusou Symmetry,想像シンメトリー,そうぞうしんめとりー
Kuusou Symphony,空想シンフォニー,くうそうしんふぉにー
Kuusou Synesthesia ,空想シナスタジア,くうそうしなすたじあ
Kuusou Synesthesia ,空想シナスタジア,くうそうしなすたじあ
Kuusou Teien Izonshou,空想庭園依存症,くうそうていえんいそんしょう
Kuusou Train,空想トレイン,くうそうとれいん
Kuusou Trip,空想トリップ,くうそうとりっぷ
Kuusou Vacation,空想バケーション,くうそうばけーしょん
Kuusou Waitress,空想ウェイトレス,くうそううぇいとれす
Kuzure yuku sekai ni sayonara o iu boku wa,崩れゆく世界にさよならを言う僕は,くずれゆくせかいにさよならをいうぼくは
Kyapirun ♪  Boukaloid,きゃぴるん♪ 防火ロイド,きゃぴるんぼうかろいど
Kyo no Miyako,虚の都,うろのと
Kyō To Ashita No Kōsaten,今日と明日の交差点,きょうとあしたのこうさてん
Kyo to Jitsu,虚と実,うろとみのる
Kyodai Mousou to Glide,巨大妄想とグライド,きょだいもうそうとぐらいど
Kyodai Nasu no Uta,巨大茄子の詩,きょだいなすびのし
Kyôfu no Machi,恐怖の街,きょうふのまち
Kyogenbatake de Sayounara,虚言畑でさようなら,きょげんはたけでさようなら
Kyogenguse Shoujo to Prisoner Kareshi,虚言癖少女とプリズナー彼氏,きょげんへきしょうじょとぷりずなーかれし
Kyogi ni Kaesu,虚偽に帰す,きょぎにきす
Kyogisei no Spectre,虚偽性のスペクトル,きょぎせいのすぺくとる
Kyogisei no Spectre,虚偽性のスペクトル,きょぎせいのすぺくとる
Kyōkai Sentimental,境界センチメンタル,きょうかいせんちめんたる
Kyokou no Masquerade,虚構のマスカレイド,きょこうのますかれいど
Kyokou no Shangri-La,虚構のシャングリラ,きょこうのしゃんぐりら
Kyokou to Lambda,虚構とラムダ,きょこうとらむだ
Kyoku Tsukuri no Reason,曲作りのリーズン,きょくづくりのりーずん
Kyokudou Shiki,極東史記,きょくとうしき
Kyokugei Joou-sama,曲芸女王様,きょくげいじょおうさま
Kyokugen Egoism,極限エゴイズム,きょくげんえごいずむ
Kyokugen Finder,極限ファインダー,きょくげんふぁいんだー
Kyokusei ni Nobasu Yubi,極星に伸ばす指,ごくほしにのばすゆび
Kyokutou Decadence,極東デカダンス,きょくとうでかだんす
Kyokutou Euphoria,極東ユーフォリア,きょくとうゆーふぉりあ
Kyokutou Romanesque,極東ロマネスク,きょくとうろまねすく
Kyokutsuu,極通,きょくどおり
Kyokuya no Waltz,極夜のワルツ,きょくやのわるつ
Kyomu o Moyashita Kimi no Taion,虚無を燃やした君の体温,きょむをもやしたきみのたいおん
Kyomu o Moyashita Kimi no Taion,虚無を燃やした君の体温,きょむをもやしたきみのたいおん
kyoshin frequency,響心周波数,ひびきしんしゅうはすう
Kyoshitsu Yori,虚室より,うろしつより
KYOTO BOJYO,京都慕情,きょうとぼじょう
Kyoto Candy Store War,京都ダ菓子屋センソー,きょうとだかしやせんそー
Kyoto Dagashiya Sensou,京都ダ菓子屋センソー,きょうとだかしやせんそー
Kyoto Dagashiya Sensou,京都ダ菓子屋センソー,きょうとだかしやせんそー
Kyoto Dagashiya Sensou,京都ダ菓子屋センソー,きょうとだかしやせんそー
Kyoto Dagashiya Sensou,京都ダ菓子屋センソー,きょうとだかしやせんそー
Kyoto Highlight,京都ハイライト,きょうとはいらいと
Kyou Ai Loneliness ,狂愛ロンリネス,きょうあいろんりねす
Kyou Atta Kanashii Koto o Oshiete,今日あった哀しいことを教えて,きょうあったかなしいことをおしえて
Kyou Dake wa.,今日だけは。,きょうだけは
Kyou Kimi wa,今日君は,きょうくんは
Kyou mo Hibikanai Uta o Kimi ni Utai Tsudzukeru,今日も響かない歌を君に歌い続ける,きょうもひびかないうたをきみにうたいつづける
Kyou mo Kibun wa Ohime-sama,今日も気分はお姫様,きょうもきぶんはおひめさま
Kyou mo Kichou na Sanso o Shouhi Shita Dake Deshita,今日も貴重な酸素を消費しただけでした,きょうもきちょうなさんそをしょうひしただけでした
Kyou mo Kyou tote Neglect,今日も今日とてネグレクト,きょうもきょうとてねぐれくと
Kyou mo Makuramoto de Sakebi Tsudzuketekuru...,今日も枕元で叫び続けてくる・・・,きょうもまくらもとでさけびつづけてくる
Kyou mo Watashi wa Ganbaranai,今日も私はがんばらない,きょうもわたしはがんばらない
Kyou mo Watashi wa Ganbaranai,今日も私はがんばらない,きょうもわたしはがんばらない
Kyou mo Yuuhi wa Shizumu,今日も夕陽は沈む,きょうもゆうひはしずむ
Kyou no Boku wa Doko,今日のボクはどこ,きょうのぼくはどこ
Kyou no hi wa sayounara,今日の日はさようなら,きょうのひはさようなら
Kyou no Hi wa Sayounara,今日の日はさようなら,きょうのひはさようなら
Kyou no Sekai wa Kagayaki ni Michita,今日の世界は輝きに満ちた,きょうのせかいはかがやきにみちた
Kyou no Shock na Dekigoto.,今日のショックな出来事。,きょうのしょっくなできごと
Kyou wa Christmas to Iu Hi,今日はクリスマスという日,きょうはくりすますというひ
Kyou wa Dekai Tsuki,今日はでかい月,きょうはでかいつき
Kyou wa Hare Datte,きょうは晴れだって,きょうははれだって
Kyou wa Hitori de,今日は一人で,きょうはひとりで
Kyou wa Ii Tsuitachi de Arimasu You ni,今日は良い一日でありますように,きょうはよいいちにちでありますように
Kyou wa Kishinenryo ga Omoi,今日は希死念慮が重い,きょうはきしねんりょがおもい
Kyou wa Nan Milli,今日は何ミリ,きょうはなんみり
Kyou wa Neko no Hi,今日は ねこの日,きょうはねこのひ
Kyou wa Oyasumi datta,今日はおやすみだった,きょうはおやすみだった
Kyou wa Tabibiyori,今日は旅びより,きょうはたびびより
Kyouai Sanka,狂愛散華,きょうあいさんげ
Kyouaku Loop,凶悪ループ,きょうあくるーぷ
Kyoudan Bit Ray,教壇ビットレイ,きょうだんびっとれい
Kyouen no β,饗宴のβ,きょうえんのべーた
Kyoufu Garden,恐怖ガーデン,きょうふがーでん
Kyoufu Garden,恐怖ガーデン,きょうふがーでん
Kyoufu Garden,恐怖ガーデン,きょうふがーでん
Kyoufu Garden,恐怖ガーデン,きょうふがーでん
Kyoufu Garden,恐怖ガーデン,きょうふがーでん
Kyoufu Garden,恐怖ガーデン,きょうふがーでん
Kyoufu Garden,恐怖ガーデン,きょうふがーでん
Kyoufu Garden,恐怖ガーデン,きょうふがーでん
Kyoufu no Yakata to Futari no Shoujo,恐怖の館と二人の少女,きょうふのかんとふたりのしょうじょ
Kyoufu! Supiikaa Ningen,恐怖!スピーカー人間,きょうふすぴーかーにんげん
Kyoufuu Hello,狂風ハロー,きょうふうはろー
Kyouizon Lakeside,共依存レイクサイド,きょういそんれいくさいど
Kyouji no Tsurugi,矜持の剣,きょうじのけん
