Sekiranun Graffiti,積乱雲グラフィティ,せきらんうんぐらふぃてぃ
Sekiranun Graffiti,積乱雲グラフィティ,せきらんうんぐらふぃてぃ
Sekiranun Graffiti,積乱雲グラフィティ,せきらんうんぐらふぃてぃ
Sekiranun Graffiti,積乱雲グラフィティ,せきらんうんぐらふぃてぃ
Sekiranun Graffiti,積乱雲グラフィティ,せきらんうんぐらふぃてぃ
Sekiranun Graffiti,積乱雲グラフィティ,せきらんうんぐらふぃてぃ
Sekiranun Graffiti,積乱雲グラフィティ,せきらんうんぐらふぃてぃ
Sekiranun Graffiti,積乱雲グラフィティ,せきらんうんぐらふぃてぃ
Sekiranun Gurafiti,積乱雲グラフィティ,せきらんうんぐらふぃてぃ
Sekiranun,積乱雲,せきらんうん
Sekirara Candy,赤裸々キャンディ,せきららきゃんでぃ
Sekirara Youyou,赤裸々踊々,せきららおどり々
Sekiryou no Medusa,寂寥のメデューサ,せきりょうのめでゅーさ
Sekisen,夕染,ゆうそめ
Sekisetsu Rock,積雪ロック,せきせつろっく
Sekiyou ni Somaru made,夕陽に染まるまで,ゆうひにそまるまで
Sekiyou no Suisou,夕陽の水葬,ゆうひのすいそう
Sekizui Eki Hatsukari Ressha,セキズイ駅発下り列車,せきずいえきはつくだりれっしゃ
Sekka Chou,雪華蝶,ゆきはなちょう
Sekka no Machi,雪花の街,ゆきはなのまち
Sekka no Yoru,雪華の夜,ゆきはなのよる
Sekka Ryouran,雪花繚乱,ゆきはなりょうらん
Sekka Ryouran,雪花繚乱,ゆきはなりょうらん
Sekka Ryouran,雪花繚乱,ゆきはなりょうらん
Sekka Ryouran,雪花繚乱,ゆきはなりょうらん
Sekka,雪華,ゆきはな
Selene no Namida,セレーネの涙,せれーねのなみだ
Selene no Namida,セレネの泪,せれねのなみだ
Self Blow Job Monk In Chiba Blues,己錯口淫僧侶入千葉泥臭労働節,おのれ錯口淫僧侶入ちばどろしゅうろうどうぶし
Self Blow Job Monk In Chiba Blues,己錯口淫僧侶入千葉泥臭労働節,おのれ錯口淫僧侶入ちばどろしゅうろうどうぶし
Self Dictatorship,自我独裁,じがどくさい
Self Hatred,自己嫌悪,じこけんお
Self Inflicted Achromatic,自傷無色,じしょうむしょく
Self Inflicted Achromatic,自傷無色,じしょうむしょく
Self-comfort,自我安慰,じがやす慰
Self-Inflicted Achromatic,自傷無色,じしょうむしょく
Self-Love,自惚れ,うぬぼれ
Self-Willed Girl,任性,にんせい
Selfish Sacrifice,自私的奉献,じしてきほうけん
Semai Heya no Aquarium,狭い部屋のアクアリウム,せまいへやのあくありうむ
Semai Kyoushitsu kara Sora o Mitara,狭い教室から空を見たら,せまいきょうしつからそらをみたら
Semete Shigatsu Made Wa,せめて四月までは,せめてしがつまでは
Semete Uta no Naka de wa Shiawase de Isasete yo,せめて歌の中では幸せで居させてよ,せめてうたのなかではしあわせでいさせてよ
Semishigure wa Mada Yamanai,蝉時雨はまだ止まない,せみしぐれはまだやまない
Sen Kilometer,千キロメートル,せんきろめーとる
Sen'aika,染哀歌,そめあいか
Sen'i Hito-kukaku,遷移一区画,せんいいちくかく
Sen'otome e no Tsuioku,戦乙女への追憶,せんおとめへのついおく
Sen'yazuki,千夜月,せんないと
Sen'yuu! Makai Broadband,占勇!魔界ブロードバンド,うらないいさむまかいぶろーどばんど
Sena ni Suwabuki,背に咳き,せにせき
Senbadzuru,千羽鶴,せんばづる
Senboku Scrying,占卜スクライング,うらないぼくすくらいんぐ
Senbonzakura (Acoustic Guitar Version),千本桜【アコースティックギター・バージョン】,せんぼんざくらあこーすてぃっくぎたーばーじょん
Senbonzakura (Kuchibue Version),千本桜  ( 口笛バージョン ),せんぼんざくらくちぶえばーじょん
Senbonzakura (Nidai Piano Version),千本桜【2台ピアノバージョン】,せんぼんざくらにだいぴあのばーじょん
Senbonzakura (Youkin Version),千本桜【揚琴バージョン】,せんぼんざくらようきんばーじょん
Senbonzakura x Roshin Yuukai,千本桜×炉心融解,せんぼんざくらかけるろしんゆうかい
Senbonzakura【Gut Guitar Version】,千本桜【ガットギターバージョン】,せんぼんざくらがっとぎたーばーじょん
Senbonzakura【Orgel Hen】,千本桜【オルゴール編】,せんぼんざくらおるごーるへん
Senbonzakura【Original Karaoke】,千本桜【オリジナルカラオケ】,せんぼんざくらおりじなるからおけ
Senchi Mental Journey,戦地精神ジャーニー,せんちせいしんじゃーにー
Send to the Bright Moon,寄明月,やどりきめいげつ
Send to the Bright Moon,寄明月,やどりきめいげつ
Sengeki Gray Moon,閃撃グレイムーン,ひらめき撃ぐれいむーん
Sengeki Gray Moon,閃撃グレイムーン,ひらめき撃ぐれいむーん
Sengoku Butou,戦刻舞闘,せんこくまい闘
Sengoku Butou,戦刻舞闘,せんこくまい闘
Sengoku Love Sword,戦国ラブソード,せんごくらぶそーど
Sengoku Love Sword,戦国ラブソード,せんごくらぶそーど
Sengoku Love Sword,戦国ラブソード,せんごくらぶそーど
Sengoku Requiem,戦国レクイエム,せんごくれくいえむ
Sengoku☆a☆Tension,戦国☆あ☆てんしょん,せんごくあてんしょん
Senjou de Tea-Time,戦場でティータイム,せんじょうでてぃーたいむ
Senjou Mind,戦場マインド,せんじょうまいんど
Senjou no Boy Meets Girl,戦場のボーイミーツガール,せんじょうのぼーいみーつがーる
Senjou no Merry Christmas,戦場のメリークリスマス,せんじょうのめりーくりすます
Senka Ryouran,戦華繚乱,せんはなりょうらん
Senketsuseika,鮮血誓歌,せんけつちかいか
Senkō Hanabi,千光花火,ちこうはなび
Senkou Descender,閃光ディセンダー,せんこうでぃせんだー
Senkou Floria,閃光フローリア,せんこうふろーりあ
Senkou Hanabi,殲紅華火,殲紅はなひ
Senkou no Brionac,閃鋼のブリューナク,ひらめきこうのぶりゅーなく
Senkou no Brionac,閃鋼のブリューナク,ひらめきこうのぶりゅーなく
Senkou no Fortune,閃光のフォーチュン,せんこうのふぉーちゅん
Senkou no Ryuu Naku Hakoniwa Yori,鮮紅ノ龍啼ク箱庭拠リ,せんこうのりゅう啼くはこにわよりどころり
Senkou Resurrection,閃光リザレクション,せんこうりざれくしょん
Senkou Schneider,閃光シュナイダー,せんこうしゅないだー
Senkou Signal,閃光シグナル,せんこうしぐなる
Senkou Vanish,閃光バニッシュ,せんこうばにっしゅ
Senkuu no Embrace,閃空のエンブレイス,ひらめきそらのえんぶれいす
Senkyo e Ikou!,選挙へ行こう!,せんきょへいこう
Senmeina kurenai to,鮮明な紅と,せんめいなべにと
Senmenki ni Totsuida Hitsuji・Mary,洗面器に嫁いだ羊・メリー,せんめんきにとついだひつじめりー
Senmetsu no guilty,殲滅のギルティ,せんめつのぎるてぃ
Sennaki Koto,詮無きこと,せんなきこと
Sennen Ai,千年愛,ちとせあい
Sennen hitoyo no yume,千年一夜の夢,ちとせいちやのゆめ
Sennen Kouyou,千年紅葉,ちとせこうよう
Sennen no ame no owari ni,千年の雨の終わりに,ちとせのあめのおわりに
Sennen no ame no owari ni,千年の雨の終わりに,ちとせのあめのおわりに
Sennen no Dokusou Ka,千年の独奏歌,ちとせのどくそうか
Sennen no Dokusou Ka,千年の独奏歌,ちとせのどくそうか
Sennen no Dokusou Ka,千年の独奏歌,ちとせのどくそうか
Sennen no Dokusouka,千年の独奏歌,ちとせのどくそうか
Sennen no Dokusouka,千年の独奏歌,ちとせのどくそうか
Sennen no Dokusouka,千年の独奏歌,ちとせのどくそうか
Sennen no Dokusouka,千年の独奏歌,ちとせのどくそうか
Sennen no Dokusouka,千年の独奏歌,ちとせのどくそうか
Sennen no Dokusouka,千年の独奏歌,ちとせのどくそうか
Sennen no Dokusouka,千年の独奏歌,ちとせのどくそうか
Sennen no Dokusouka,千年の独奏歌,ちとせのどくそうか
Sennen no Dokusouka,千年の独奏歌,ちとせのどくそうか
Sennen no Dokusouka,千年の独奏歌,ちとせのどくそうか
Sennen no Dokusouka,千年の独奏歌,ちとせのどくそうか
Sennen no Dokusouka,千年の独奏歌,ちとせのどくそうか
Sennen no Dokusouka,千年の独奏歌,ちとせのどくそうか
Sennen no Han'ei no Sennenme,千年の繁栄の千年目,ちとせのはんえいのちとせめ
Sennen No Kitsune,千年の狐,ちとせのきつね
Sennen Time Capsule,1000年タイムカプセル,せんねんたいむかぷせる
Sennenki no Owari,千年紀の終わり,せんねんきのおわり
Sennou Denpa,洗脳電波,せんのうでんぱ
Sennou Noise Maker,洗脳ノイズメイカー,せんのうのいずめいかー
Sennou,洗脳,せんのう
Sennou,洗脳,せんのう
Sennou,洗脳,せんのう
Sennya no Kagi to Yuutousei Shoujo,千夜の鍵と優等生少女,せんやのかぎとゆうとうせいしょうじょ
Sennyuu 02,潜入02,せんにゅう
Senpai no Guitar,先輩のギター,せんぱいのぎたー
Senpen Banka,千篇晩夏,せんへんばんか
Senpenbanka☆Egoism,千変万花☆エゴイズム,せんへんまんはなえごいずむ
Senpuuki no Theme,扇風機のテーマ,せんぷうきのてーま
Senpuuki Uchuubito,扇風機宇宙人,せんぷうきうちゅうじん
Senritsu no Shijuusou (Quartet),戦律の四重奏(カルテット),せんりつのしじゅうそうかるてっと
Senritsu wa Tsuki ni Sasoware te,旋律は月に誘われて,せんりつはつきにさそわれて
Senritsuouki,旋律王姫,せんりつおうひめ
Senro wa Tsuzuku yo Dokomademo,線路は続くよどこまでも,せんろはつづくよどこまでも
Sensational no Yokunen,センセーショナルの翌年,せんせーしょなるのよくねん
Sensational Takajo,センセーショナル高女,せんせーしょなるたかおんな
Sense of Presence Zero Girl,存在感零少女,そんざいかんれいしょうじょ
Sensei to Seito no Love Game,先生と生徒のラブゲーム,せんせいとせいとのらぶげーむ
Sensen Fukoku Blind,宣戦布告ブラインド,せんせんふこくぶらいんど
Sensen Fukoku Blind,宣戦布告ブラインド,せんせんふこくぶらいんど
Senshoku to Ade no Kyoukai,千色と艶の境界,ちいろとつやのきょうかい
Senshuu Ichiya,千秋一夜,ちあきかずよ
Senshuu Ichiya,千秋一夜,ちあきかずよ
Senshuu Ichiya,千秋一夜,ちあきかずよ
Senshuu Ichiya,千秋一夜,ちあきかずよ
Senshuu Ichiya,千秋一夜,ちあきかずよ
Senshuu Ichiya,千秋一夜,ちあきかずよ
Senshuu Ichiya,千秋一夜,ちあきかずよ
Senshuu Ichiya,千秋一夜,ちあきかずよ
Sensuikan Pandemonium,潜水艦パンデモニウム,せんすいかんぱんでもにうむ
Sensuikan Traumerei,潜水艦トロイメライ,せんすいかんとろいめらい
Sentakumono ga Kawakanai,洗濯物が乾かない,せんたくぶつがかわかない
Sentakushi Girl,選択肢ガアル,せんたくしがある
Sentakusou to Time Lag,洗濯槽とタイムラグ,せんたくそうとたいむらぐ
Sentakusou to Time Lag,洗濯槽とタイムラグ,せんたくそうとたいむらぐ
Sentensei Kouhai Syndrome,先天性荒廃症候群,せんてんせいこうはいしょうこうぐん
Sentimental Junjou Line,センチメンタル純情ライン,せんちめんたるじゅんじょうらいん
Sentimental na Aibo Kokoro,センチメンタルな愛慕心,せんちめんたるなあいぼしん
Sentimental na Aiboshin,センチメンタルな愛慕心,せんちめんたるなあいぼしん
Sentimental na Aiboshin,センチメンタルな愛慕心,せんちめんたるなあいぼしん
Sentimental Rain,感傷レイン,かんしょうれいん
Sentimentalism Paranoia,殉情パラノイア,じゅんじょうぱらのいあ
Seo-chan Onigiri Katte koi!,せおちゃんおにぎり買ってこい!,せおちゃんおにぎりかってこい
Sepia-iro no Symfonia,セピア色のシンフォニア,せぴあいろのしんふぉにあ
September Friend,繰りかえす7月の友達,くりかえすしちがつのともだち
Serenade no Owari Made,セレナーデの終わりまで,せれなーでのおわりまで
Serenade of Fallin' Angel -I'm No Angel-,堕天使セレナーデー天使なんかじゃないー,だてんしせれなーでーてんしなんかじゃないー
Serenade,夜想曲,やそうきょく
Serenity,静謐,せいひつ
Service Zangyou,サービス残業,さーびすざんぎょう
Sesame Porridge,芝麻香,しばあさか
Sesshin,雪心,ゆきしん
Sesuji o Nobashite,背筋をのばして,せすじをのばして
Setagaya Night Safari,世田谷ナイトサファリ,せたがやないとさふぁり
Setagaya Night Safari,世田谷ナイトサファリ,せたがやないとさふぁり
Setouchi Departure,瀬戸内デパーチャー,せとうちでぱーちゃー
Setsu wa Tendou,説は天動,せつはてんどう
Setsuei,雪影,ゆきかげ
Setsugen no Kioku,雪幻ノ記憶,ゆきまぼろしのきおく
Setsugen wo Iku,雪原を往く,せつげんをゆく
Setsugen,雪幻,ゆきまぼろし
setsugetsufuka,雪月風花,せつげつふうか
Setsugetsuka Dance Version,雪月花 ダンスバージョン,せつげっかだんすばーじょん
Setsugetsuka no Toki Kimi wo Omou,雪月花ノ時君ヲ憶フ,せつげっかのときくんをおもうふ
Setsugetsuka,刹月華,刹月はな
Setsugetsuka,紲月歌,きずなつきか
Setsugetsuka,紲月歌,きずなつきか
Setsugetsuka,雪月花,せつげっか
Setsugetsuka,雪月花,せつげっか
Setsugetsuka,雪月花,せつげっか
Setsugetsuka,雪月花,せつげっか
Setsugetsuka,雪月花,せつげっか
Setsugetsukou,雪月香,ゆきつきこう
Setsugetsukou,雪月香,ゆきつきこう
Setsujou,螺旋,らせん
Setsujou,螺旋,らせん
Setsumen Tomoshibi,雪面灯火,ゆきめんともしび
Setsumusou,雪夢葬,ゆきゆめそう
Setsuna ni Nigau,刹那に願う,せつなにねがう
Setsuna no Haru ~ Koi no Yume wa Sakurairo ~,刹那の春 ー恋の夢は桜色ー,せつなのはるーこいのゆめはさくらいろー
Setsuna no Zankō,刹那の残光,せつなのざんこう
Setsuna Plus,刹那プラス,せつなぷらす
Setsuna Plus,刹那プラス,せつなぷらす
Setsuna Plus,刹那プラス,せつなぷらす
Setsuna Plus,刹那プラス,せつなぷらす
Setsuna Plus,刹那プラス,せつなぷらす
Setsuna Plus,刹那プラス,せつなぷらす
Setsuna Plus,刹那プラス,せつなぷらす
Setsuna Resistance,刹那レジスタンス,せつなれじすたんす
Setsuna Serenade,刹那セレナーデ,せつなせれなーで
Setsuna-teki Teiten Kansoku,刹那的定点観測,せつなてきていてんかんそく
Setsunai Boku wa Sakebu,切ない僕は叫ぶ,せつないぼくはさけぶ
Setsunaki∞Rasen Algorithm,刹那キ∞螺旋アルゴリズム,せつなきらせんあるごりずむ
Setsunaki∞Rasen Algorithm,刹那キ∞螺旋アルゴリズム,せつなきらせんあるごりずむ
Setsunasa Moeru Labyrinth,切なさ燃える ラビリンス,せつなさもえるらびりんす
Setsunasa wa Shiranai Mama,せつなさは知らないまま,せつなさはしらないまま
Setsuren,切恋,せつこい
Setsurenka,切恋歌,せつこいうた
Setting of a Sleeping Sea,イリス眠るこの海に,いりすねむるこのうみに
Seumei No Nakade,生命の中で,せいめいのなかで
Seven Seconds of Love,七秒之恋,ななびょうのこい
Seven Seconds of Love,七秒之恋,ななびょうのこい
Shabontama Melody,シャボン玉メロディー,しゃぼんだまめろでぃー
Shachiku Senshi Kyatoraiza,社畜戦士キャトライザー,しゃちくせんしきゃとらいざー
Shadow of Summer,夏之影,なつのかげ
Shadow Stepping Wind,影踏み,かげふみ
Shadows on the night street,雨街夜道の影模様,あめがいよみちのかげもよう
SHAGAN DAISHI,遮眼大師,さえぎめだいし
Shajou no Yumekui Shoujo,沙上の夢喰い少女,いさごじょうのゆめくいしょうじょ
Shajou no Yumekui Shoujo,沙上の夢喰い少女,いさごじょうのゆめくいしょうじょ
Shaka Rock Chuudoku,釈迦ロック中毒,しゃかろっくちゅうどく
Shakai Shugi★Darling,社会主義★だーりんっ,しゃかいしゅぎだーりんっ
Shakai Shugi★Darling,社会主義★だーりんっ,しゃかいしゅぎだーりんっ
Shakanteki Melancholy,主観的メランコリー,しゅかんてきめらんこりー
shake the sky,空ヲ鳴ラセ,そらをならせ
Shakko Touron,昔己討論,むかしおのれとうろん
Shakunageiro no Oto,石楠花色の音,しゃくなげしょくのおと
Shakunageiro no Oto,石楠花色の音,しゃくなげしょくのおと
Shall I Tell an Old Tale?,昔の話をしましょうか,むかしのはなしをしましょうか
Shama,紗痲,しゃ痲
Shampoo ga Me ni Haitta,シャンプーが目に入った,しゃんぷーがめにはいった
Shanai no Hangyakusha,社内の反逆者,しゃないのとりずなー
Shanghai Electro,上海エレクトロ,しゃんはいえれくとろ
Shanghai no Odoriko,上海の踊り子,しゃんはいのおどりこ
Shanghai★Disco,上海★ディスコ,しゃんはいでぃすこ
Shanghai☆Disco,上海☆ディスコ,しゃんはいでぃすこ
Shangtianhai,上天海,うえてんかい
Shanhe yu ni,山河予你,さんが予你
Shào Nǚ de Wán Jù,少女的玩具,しょうじょてきおもちゃ
Sháohuá wèiyāng,韶華未央,韶華みお
Shàonián yǔ Qiū,少年与秋,しょうねんあずかあき
Shàonián,少年,しょうねん
Shaonü Douniushi,少女斗牛士,しょうじょとうしし
Shaonü Douniushi,少女斗牛士,しょうじょとうしし
Shaonü Douniushi,少女斗牛士,しょうじょとうしし
Shaseisuru Washlet,写生するウォシュレット,しゃせいするうぉしゅれっと
Shashin/Shuudan Rakka,遮心​/​集団落下,さえぎこころしゅうだんらっか
Shasou no Kanojo e,車窓の彼女へ,しゃそうのかのじょへ
Shayō,斜陽,しゃよう
shazainoousama,奢罪の王様王の罪捨,おごつみのおうさまおうのつみ捨
Shazaiteki 3-punkan,謝罪的3分間,しゃざいてきさんぷんかん
Shazaiteki 3-punkan,謝罪的3分間,しゃざいてきさんぷんかん
Shchedryk,Щедрик,Щедрик
She is bilingual,彼女はバイリンガル,かのじょはばいりんがる
She is Still Alive,彼女はまだ、生きている,かのじょはまだいきている
Sheep and Her Neighbor,羊と隣人,ひつじとりんじん
Shēn Kōng Lǚ Xíng Shào Nǚ,深空旅行少女,しんくうりょこうしょうじょ
Sheng Pi Zi,生僻字,なまへきじ
Shēnhǎi xīng,深海星,ふかかいせい
Shepherd of the Stars,牧星者,まきほししゃ
Shepherd of the Stars,牧星者,まきほししゃ
Sherbet Blue no Kaze,シャーベットブルーの風,しゃーべっとぶるーのかぜ
Sheryl no Kamikazari,シェリルの髪飾り,しぇりるのかみかざり
Shí Jǐ Shàonǚ,食己少女,しょくおのれしょうじょ
Shi ni Itaru Yamai ni Imi wa Nai.,死に至る病に意味はない。,しにいたるやまいにいみはない
Shi no Yama o Koete,死の山を越えて,しのやまをこえて
Shi Wo de Nanhai,是我的男孩,ぜがてきおとこ孩
Shi-kyoku,詩曲,しきょく
Shiawase 10cm,幸せ10センチ,しあわせじゅうせんち
Shiawase Barometer,幸せバロメーター,しあわせばろめーたー
Shiawase Furisosogu Seinaru Yoru ni wa,幸せ降り注ぐ聖なる夜には,しあわせふりそそぐせいなるよるには
Shiawase ga Tsuzuku You ni,幸せが続くように,しあわせがつづくように
Shiawase Hamburger,幸せハンバーグ,しあわせはんばーぐ
Shiawase janai kara te o tatakenai,幸せじゃないから手を叩けない,しあわせじゃないからてをはたけない
Shiawase janai kara te o tatakenai,幸せじゃないから手を叩けない,しあわせじゃないからてをはたけない
Shiawase na Neko no Tsuitachi,幸せな猫の一日,しあわせなねこのひといち
Shiawase ni Nareru Kakushi Command ga Arurashii,幸せになれる隠しコマンドがあるらしい,しあわせになれるかくしこまんどがあるらしい
Shiawase ni Nareru Kakushi Command ga Arurashii,幸せになれる隠しコマンドがあるらしい,しあわせになれるかくしこまんどがあるらしい
Shiawase ni Nareru Kakushi Command ga Arurashii,幸せになれる隠しコマンドがあるらしい,しあわせになれるかくしこまんどがあるらしい
Shiawase ni Nareru Kakushi Command ga Arurashii,幸せになれる隠しコマンドがあるらしい,しあわせになれるかくしこまんどがあるらしい
Shiawase ni Nareru Kakushi Command ga Arurashii,幸せになれる隠しコマンドがあるらしい,しあわせになれるかくしこまんどがあるらしい
Shiawase ni Nareru Kakushi Command ga Arurashii,幸せになれる隠しコマンドがあるらしい,しあわせになれるかくしこまんどがあるらしい
Shiawase ni Nareru Kakushi Command ga Arurashii,幸せになれる隠しコマンドがあるらしい,しあわせになれるかくしこまんどがあるらしい
Shiawase ni Nareru Kakushi Command ga Arurashii,幸せになれる隠しコマンドがあるらしい,しあわせになれるかくしこまんどがあるらしい
Shiawase ni Nareru Kakushi Command ga Arurashii,幸せになれる隠しコマンドがあるらしい,しあわせになれるかくしこまんどがあるらしい
Shiawase ni Nareru Kakushi Command ga Arurashii,幸せになれる隠しコマンドがあるらしい,しあわせになれるかくしこまんどがあるらしい
Shiawase ni Nareru Kakushi Command ga Arurashii,幸せになれる隠しコマンドがあるらしい,しあわせになれるかくしこまんどがあるらしい
Shiawase ni Nareru Kakushi Command ga Arurashii,幸せになれる隠しコマンドがあるらしい,しあわせになれるかくしこまんどがあるらしい
Shiawase no Cinderella Shoes,幸せのシンデレラシューズ,しあわせのしんでれらしゅーず
Shiawase no Glass,幸せのグラス,しあわせのぐらす
Shiawase no Hitohira,幸せの一枚,しあわせのいちまい
Shiawase no Lavender,幸せのラベンダー,しあわせのらべんだー
Shiawase no Mahou o Kakeyou,幸せの魔法をかけよう,しあわせのまほうをかけよう
Shiawase o Matou,幸せを纏う,しあわせをまとう
Shiawase o Negau Kenri Sae Nakushita,幸せを願う権利さえなくした,しあわせをねがうけんりさえなくした
Shiawase o Oborenai,しあわせを忘れない,しあわせをわすれない
Shiawase Signal,幸せシグナル,しあわせしぐなる
Shiawase wa Kanashii Uta,幸せは悲しい詩,しあわせはかなしいし
Shiawase-iro ni Somare,しあわせ色に染まれ,しあわせしょくにそまれ
Shiawase-iro ni Somare,しあわせ色に染まれ,しあわせしょくにそまれ
Shiawasemono,幸せ者,しあわせしゃ
Shiawasemono,幸せ者,しあわせしゃ
Shiawasemono,幸せ者,しあわせしゃ
Shibu Gassengo no Uta,四部合唱んごのうた,しぶがっしょうんごのうた
Shibuya Catostrophy,渋谷カタストロフィ,しぶやかたすとろふぃ
Shichigatsu Juukunichi wa Eien ni,七月十九日は永遠に,しちがつじゅうきゅうにちはえいえんに
Shichigatsu no Spica,七月のスピカ,しちがつのすぴか
Shichigatsu no Yuukei wa Kimi wo Kou,七月の夕景は君を恋う,しちがつのゆうけいはきみをこう
Shichigatsu Sanjuuichinichi,7月30日,しちがつさんじゅうにち
Shichijouya,七常夜,ななつねよ
Shichine Youko no Kazoe Uta,七音幼子の数え歌,しちおんおさなごのかぞえうた
Shichiten Battou,七転罵倒,ななてんばとう
Shichiten Hakki Koushin Uta,七転八起行進歌,しちてんはっきこうしんか
Shidome no Haru,四度目の春,よんどめのはる
Shien 13 no Theme Song - Garyuu Rock!!,しえん13のテーマソング-我流ロック!!,しえんのてーまそんぐがりゅうろっく
Shien Cider,紫煙サイダー,しえんさいだー
Shien,紫苑,しおん
Shiganai Koichimin,しがない小市民,しがないしょうしみん
Shigatsu wa Zankoku na Kisetsu,四月は残酷な季節,しがつはざんこくなきせつ
Shigetsu to Nure'en,紫月と濡れ縁,しづきとぬれえん
Shigoto o Yameta,仕事を辞めた,しごとをやめた
Shigune ni Hanataba o,シグネに花束を,しぐねにはなたばを
Shigure no ato,時雨の後,しぐれののち
Shigure Tender,時雨テンダー,しぐれてんだー
Shigure Tender,時雨テンダー,しぐれてんだー
Shihai Bunshi Scherzo,支配分子スケルツォ,しはいぶんしすけるつぉ
Shihai Bunshi Scherzo,支配分子スケルツォ,しはいぶんしすけるつぉ
Shihai Kakumei Hero,支配革命ヒーロー,しはいかくめいひーろー
Shihatsu to Kafka,始発とカフカ,しはつとかふか
Shihatsu to Kafka,始発とカフカ,しはつとかふか
Shihatsu to Kafka,始発とカフカ,しはつとかふか
Shihatsu to Kafka,始発とカフカ,しはつとかふか
Shiina and Broad Daylight,シイナと白昼,しいなとはくちゅう
Shiina no March,粃ノ行進曲,しいなのこうしんきょく
Shijima ga Kikoeru,静寂がきこえる,せいじゃくがきこえる
